{
  "user_id": "demo_user",
  "full_name": "Alex Mercer",
  "email": "alex.mercer@example.com",
  "date_of_birth": "1980-06-15",
  "age": 46,
  "marital_status": "married",
  "dependents_count": 2,
  "family_members": [
    {
      "name": "Sarah Mercer",
      "relationship": "spouse",
      "age": 44
    },
    {
      "name": "Leo Mercer",
      "relationship": "child",
      "age": 12
    },
    {
      "name": "Maya Mercer",
      "relationship": "child",
      "age": 9
    }
  ],
  "employment_status": "employed",
  "occupation": "Staff Systems Engineer",
  "annual_income_usd": 220000,
  "target_retirement_age": 61,
  "monthly_housing_payment_usd": 4200,
  "risk_tolerance_notes": "Comfortable with moderate volatility in pursuit of long-term capital appreciation; prefers broad-market index funds.",
  "financial_goals_notes": "Build a $1.5M nest egg for retirement by 2041 and maintain 6 months of liquid emergency reserves.",
  "updated_at": "2026-08-01T00:00:00Z"
}
